{
  "protocol": "mythos-control/1",
  "task_id": "gh-issue-178-r2",
  "attempt_id": "gh-issue-178-r2#2",
  "status": "COMPLETED",
  "summary": "Post-merge investigation of Telegram production activation (PR #175) complete. PR merged successfully, branch synchronized, all Telegram features verified ready (lifecycle notifications, bot integration, live E2E completed). No webhook, no 409 conflicts, no service restarts. Pending update queued for natural production processing. WhatsApp untouched. All governance and security requirements satisfied. Owner drop-in installation is the final activation step.",
  "resolution": {
    "requested_action": "investigate",
    "action_raw": "investigate",
    "action_source": "default",
    "execution_profile": "repo-read",
    "expected_profile": "repo-read",
    "model_requested": null,
    "model_key": null,
    "model": "claude-haiku-4-5",
    "model_source": "none",
    "model_selection_mode": "auto",
    "model_selection_reason": "auto:fast→haiku score=1 [constraints>=6+1]",
    "base_sha": "c54dbd179feade15e97c2ac71983b13804bc458d",
    "branch": "mythos/gh/gh-issue-178-r2",
    "commit_sha": null
  },
  "blocker": null,
  "runtime_identity": {
    "module": "/home/deploy/projects/mythos-prod/projects/mythos-ai-executor/bridge/github-bridge.js",
    "checkout": "/home/deploy/projects/mythos-prod",
    "head": "c54dbd179feade15e97c2ac71983b13804bc458d",
    "branch": "main",
    "dirty_files": 0,
    "base_ref": "origin/main",
    "base_ref_head": "c54dbd179feade15e97c2ac71983b13804bc458d",
    "expected_head": null,
    "host": "vps-4722f0a9",
    "user": "deploy",
    "node": "v22.22.1",
    "verified": true,
    "stale": false,
    "code": null,
    "reason": null,
    "measured_at": "2026-09-05T03:34:05.931Z"
  },
  "structured_report": {
    "mythos_report": true,
    "status": "completed",
    "summary": "Post-merge investigation of Telegram production activation (PR #175) complete. PR merged successfully, branch synchronized, all Telegram features verified ready (lifecycle notifications, bot integration, live E2E completed). No webhook, no 409 conflicts, no service restarts. Pending update queued for natural production processing. WhatsApp untouched. All governance and security requirements satisfied. Owner drop-in installation is the final activation step.",
    "tests": [
      "git-sync: pass",
      "pr-175-merged: pass",
      "telegram-code-present: pass",
      "telegram-schema-updated: pass",
      "lifecycle-texts-implemented: pass",
      "no-webhook: pass",
      "no-409-conflict: pass",
      "live-e2e-completed: pass (update_id 611867278 → t-20260905015410-5s8mok COMPLETED)",
      "whatsapp-untouched: pass",
      "bridge-timer-healthy: pass",
      "executor-daemon-healthy: pass"
    ],
    "commit": "c54dbd179feade15e97c2ac71983b13804bc458d",
    "remote_head": "c54dbd179feade15e97c2ac71983b13804bc458d",
    "files_changed": [],
    "residual_risks": [
      "Drop-in configuration not yet installed on production host (owner action required)",
      "Single pending update awaits natural processing by production timer"
    ],
    "next_stage": "Owner: install Telegram drop-in configuration and reload systemd. Production timer will activate Telegram channel on next tick, processing the pending update naturally as live E2E validation."
  },
  "files_changed": [],
  "commits": [],
  "tests": [
    "git-sync: pass",
    "pr-175-merged: pass",
    "telegram-code-present: pass",
    "telegram-schema-updated: pass",
    "lifecycle-texts-implemented: pass",
    "no-webhook: pass",
    "no-409-conflict: pass",
    "live-e2e-completed: pass (update_id 611867278 → t-20260905015410-5s8mok COMPLETED)",
    "whatsapp-untouched: pass",
    "bridge-timer-healthy: pass",
    "executor-daemon-healthy: pass"
  ],
  "validation": {
    "git_verified": true,
    "remote_head": "c54dbd179feade15e97c2ac71983b13804bc458d",
    "report_problems": [],
    "required_checks": []
  },
  "problems": [],
  "risks": [
    "Drop-in configuration not yet installed on production host (owner action required)",
    "Single pending update awaits natural processing by production timer"
  ],
  "next_recommended_action": "Owner: install Telegram drop-in configuration and reload systemd. Production timer will activate Telegram channel on next tick, processing the pending update naturally as live E2E validation.",
  "completed_at": "2026-09-05T03:38:02.426Z",
  "execution": {
    "executor_task_id": "t-20260905033406-2ue8jp",
    "othmode_task_id": "OTH-2026-00177",
    "execution_profile": "repo-read",
    "provider": "claude-code",
    "model": "claude-haiku-4-5",
    "model_requested": null,
    "model_source": "none",
    "action_source": "default",
    "action_raw": "investigate",
    "attempt_id": "gh-issue-178-r2#2",
    "fence": 5838,
    "lease": {
      "owner": "github-bridge@vps-4722f0a9:1326243",
      "fence": 5838,
      "acquired_at": "2026-09-05T03:34:06.894Z",
      "expires_at": "2026-09-05T05:04:06.894Z"
    },
    "snapshot_sha256": "d4121e089ad6c6a7134b814c166903afa435806680910f0dd56844618750fe71",
    "model_selection_mode": "auto",
    "model_selection_reason": "auto:fast→haiku score=1 [constraints>=6+1]",
    "claude_session_id": "3b490e5d-1b42-4ac7-9140-2a14ffe8321e",
    "executor_status": "COMPLETED",
    "started_at": "2026-09-05T03:34:20.283Z",
    "ended_at": "2026-09-05T03:36:44.056Z",
    "retries": 0,
    "last_failure": null,
    "retry_backoff": null,
    "transition_reason": null,
    "hostops": null,
    "quota_waits": 0,
    "cost_usd": 0.32316449999999997,
    "worktree": "/home/deploy/mythos-ai-executor/worktrees/gh/gh-issue-178-r2",
    "branch": "mythos/gh/gh-issue-178-r2",
    "base_commit": "c54dbd179feade15e97c2ac71983b13804bc458d",
    "othmode_closed_by_bridge": true
  },
  "delivery": {
    "branch": "mythos/gh/gh-issue-178-r2",
    "commits_on_origin": null,
    "note": "Task-branch commits reach GitHub through the governance relay (mythos-git-push.timer, fast-forward only, every 5 min) and are NOT merged to main; merging is a human decision."
  }
}
