{
  "protocol": "mythos-control/1",
  "task_id": "gh-issue-461",
  "attempt_id": "gh-issue-461#1",
  "status": "FAILED",
  "summary": "The provider did not complete: PROVIDER_FAILED — d\":0,\"unset\":0},\"started_in_background\":0,\"max_depth\":0,\"spawned_by_subagents\":0,\"completed\":0,\"failed\":0,\"killed\":{\"parent\":0,\"user\":0,\"system\":0},\"refused\":{\"depth_limit\":0,\"concurrency_limit\":0,\"budget\":0},\"by_type\":{}},\"is_error\":true,\"num_turns\":1,\"subtype\":\"success\",\"api_error_status\":null,\"result\":\"Failed to authenticate: OAuth session expired and could not be refreshed\",\"type\":\"result\",\"duration_ms\":361,\"uuid\":\"dd24ba9f-4f1d-4560-a7df-b0b556c33a7a\",\"queued_turn_count\":0,\"result_index\":0}",
  "resolution": {
    "requested_action": "investigate",
    "action_raw": "investigate",
    "action_source": "default",
    "execution_profile": "repo-read",
    "expected_profile": "repo-read",
    "model_requested": null,
    "model_key": null,
    "model": "claude-sonnet-5",
    "model_source": "none",
    "model_selection_mode": "auto",
    "model_selection_reason": "auto:balanced→sonnet score=3 [complexity_terms(architecture,security)+2 required_tests>=3+1]",
    "base_sha": "2ab1512f04db0d5709692f9575815f27eac22f30",
    "branch": "mythos/gh/gh-issue-461",
    "commit_sha": null
  },
  "blocker": {
    "code": "PROVIDER_FAILED",
    "retryable": true,
    "at": "2026-09-25T14:33:44.970Z",
    "reason": "d\":0,\"unset\":0},\"started_in_background\":0,\"max_depth\":0,\"spawned_by_subagents\":0,\"completed\":0,\"failed\":0,\"killed\":{\"parent\":0,\"user\":0,\"system\":0},\"refused\":{\"depth_limit\":0,\"concurrency_limit\":0,\"budget\":0},\"by_type\":{}},\"is_error\":true,\"num_turns\":1,\"subtype\":\"success\",\"api_error_status\":null,\"result\":\"Failed to authenticate: OAuth session expired and could not be refreshed\",\"type\":\"result\",\"duration_ms\":361,\"uuid\":\"dd24ba9f-4f1d-4560-a7df-b0b556c33a7a\",\"queued_turn_count\":0,\"result_index\":0}",
    "category": "permanent",
    "task_id": "t-20260925143329-gs4ybe",
    "attempt_id": "gh-issue-461#1",
    "requested_action": "investigate",
    "execution_profile": "repo-read",
    "model": "claude-sonnet-5"
  },
  "runtime_identity": {
    "module": "/home/deploy/projects/mythos-prod/projects/mythos-ai-executor/bridge/github-bridge.js",
    "checkout": "/home/deploy/projects/mythos-prod",
    "head": "5e868e949578bf10d9ddf49847dbf930c87b1ea5",
    "branch": "main",
    "dirty_files": 1,
    "base_ref": "origin/main",
    "base_ref_head": "5e868e949578bf10d9ddf49847dbf930c87b1ea5",
    "expected_head": null,
    "host": "vps-4722f0a9",
    "user": "deploy",
    "node": "v22.22.1",
    "verified": true,
    "stale": false,
    "code": null,
    "reason": null,
    "measured_at": "2026-09-25T14:33:25.636Z"
  },
  "structured_report": {
    "mythos_report": true,
    "synthesized": true,
    "synthesized_by": "executor",
    "status": "failed",
    "task_id": "t-20260925143329-gs4ybe",
    "attempt_id": "gh-issue-461#1",
    "requested_action": "investigate",
    "action_raw": "investigate",
    "action_source": "default",
    "execution_profile": "repo-read",
    "model": "claude-sonnet-5",
    "branch": "mythos/gh/gh-issue-461",
    "base_sha": null,
    "commit": null,
    "remote_head": null,
    "files_changed": [],
    "tests": [],
    "residual_risks": [],
    "blocker": {
      "code": "PROVIDER_FAILED",
      "retryable": true,
      "at": "2026-09-25T14:33:44.970Z",
      "reason": "d\":0,\"unset\":0},\"started_in_background\":0,\"max_depth\":0,\"spawned_by_subagents\":0,\"completed\":0,\"failed\":0,\"killed\":{\"parent\":0,\"user\":0,\"system\":0},\"refused\":{\"depth_limit\":0,\"concurrency_limit\":0,\"budget\":0},\"by_type\":{}},\"is_error\":true,\"num_turns\":1,\"subtype\":\"success\",\"api_error_status\":null,\"result\":\"Failed to authenticate: OAuth session expired and could not be refreshed\",\"type\":\"result\",\"duration_ms\":361,\"uuid\":\"dd24ba9f-4f1d-4560-a7df-b0b556c33a7a\",\"queued_turn_count\":0,\"result_index\":0}",
      "category": "permanent",
      "task_id": "t-20260925143329-gs4ybe",
      "attempt_id": "gh-issue-461#1",
      "requested_action": "investigate",
      "execution_profile": "repo-read",
      "model": "claude-sonnet-5"
    },
    "diagnosis": null,
    "summary": "The provider did not complete: PROVIDER_FAILED — d\":0,\"unset\":0},\"started_in_background\":0,\"max_depth\":0,\"spawned_by_subagents\":0,\"completed\":0,\"failed\":0,\"killed\":{\"parent\":0,\"user\":0,\"system\":0},\"refused\":{\"depth_limit\":0,\"concurrency_limit\":0,\"budget\":0},\"by_type\":{}},\"is_error\":true,\"num_turns\":1,\"subtype\":\"success\",\"api_error_status\":null,\"result\":\"Failed to authenticate: OAuth session expired and could not be refreshed\",\"type\":\"result\",\"duration_ms\":361,\"uuid\":\"dd24ba9f-4f1d-4560-a7df-b0b556c33a7a\",\"queued_turn_count\":0,\"result_index\":0}",
    "next_stage": "review this report"
  },
  "files_changed": [],
  "commits": [],
  "tests": [],
  "validation": {
    "git_verified": null,
    "remote_head": null,
    "report_problems": [],
    "required_checks": [
      "START → WhatsApp + Telegram",
      "controlled STOP/FAILURE → WhatsApp + Telegram",
      "SUCCESS → WhatsApp + Telegram",
      "no duplicate messages",
      "retry/recovery does not spam",
      "secrets never appear in messages/logs",
      "notification failure cannot block execution",
      "existing Bridge/OTHMODE behavior has no regression"
    ]
  },
  "problems": [
    "PROVIDER_FAILED: d\":0,\"unset\":0},\"started_in_background\":0,\"max_depth\":0,\"spawned_by_subagents\":0,\"completed\":0,\"failed\":0,\"killed\":{\"parent\":0,\"user\":0,\"system\":0},\"refused\":{\"depth_limit\":0,\"concurrency_limit\":0,\"budget\":0},\"by_type\":{}},\"is_error\":true,\"num_turns\":1,\"subtype\":\"success\",\"api_error_status\":null,\"result\":\"Failed to authenticate: OAuth session expired and could not be refreshed\",\"type\":\"result\",\"duration_ms\":361,\"uuid\":\"dd24ba9f-4f1d-4560-a7df-b0b556c33a7a\",\"queued_turn_count\":0,\"result_index\":0}",
    "executor: d\":0,\"unset\":0},\"started_in_background\":0,\"max_depth\":0,\"spawned_by_subagents\":0,\"completed\":0,\"failed\":0,\"killed\":{\"parent\":0,\"user\":0,\"system\":0},\"refused\":{\"depth_limit\":0,\"concurrency_limit\":0,\"budget\":0},\"by_type\":{}},\"is_error\":true,\"num_turns\":1,\"subtype\":\"success\",\"api_error_status\":null,\"result\":\"Failed to authenticate: OAuth session expired and could not be refreshed\",\"type\":\"result\",\"duration_ms\":361,\"uuid\":\"dd24ba9f-4f1d-4560-a7df-b0b556c33a7a\",\"queued_turn_count\":0,\"result_index\":0}"
  ],
  "risks": [],
  "next_recommended_action": "review this report",
  "completed_at": "2026-09-25T14:34:48.953Z",
  "execution": {
    "executor_task_id": "t-20260925143329-gs4ybe",
    "othmode_task_id": "OTH-2026-01900",
    "execution_profile": "repo-read",
    "provider": "claude-code",
    "model": "claude-sonnet-5",
    "model_requested": null,
    "model_source": "none",
    "action_source": "default",
    "action_raw": "investigate",
    "attempt_id": "gh-issue-461#1",
    "fence": 73481,
    "lease": {
      "owner": "github-bridge@vps-4722f0a9:3317660",
      "fence": 73481,
      "acquired_at": "2026-09-25T14:33:29.846Z",
      "expires_at": "2026-09-25T16:03:29.846Z"
    },
    "snapshot_sha256": "25daa92723ed7e783fbf86f96c75f47d12478a00f218b1a73649a4225e1f5ce3",
    "model_selection_mode": "auto",
    "model_selection_reason": "auto:balanced→sonnet score=3 [complexity_terms(architecture,security)+2 required_tests>=3+1]",
    "claude_session_id": "a5984b21-7071-442e-b4a5-7683207a8623",
    "executor_status": "FAILED",
    "started_at": "2026-09-25T14:33:42.497Z",
    "ended_at": "2026-09-25T14:33:44.880Z",
    "retries": 0,
    "last_failure": {
      "category": "permanent",
      "code": "PROVIDER_FAILED",
      "retryable": false,
      "timed_out": false,
      "classified_at": "2026-09-25T14:33:44.878Z"
    },
    "retry_backoff": null,
    "transition_reason": "permanent failure (PROVIDER_FAILED) — FAILED PROVIDER_FAILED — inspect stderr.log, re-queue explicitly",
    "hostops": null,
    "quota_waits": 0,
    "cost_usd": null,
    "worktree": "/home/deploy/mythos-ai-executor/worktrees/gh/gh-issue-461",
    "branch": "mythos/gh/gh-issue-461",
    "base_commit": "2ab1512f04db0d5709692f9575815f27eac22f30",
    "othmode_closed_by_bridge": true
  },
  "delivery": {
    "branch": "mythos/gh/gh-issue-461",
    "commits_on_origin": null,
    "note": "Task-branch commits reach GitHub through the governance relay (mythos-git-push.timer, fast-forward only, every 5 min) and are NOT merged to main; merging is a human decision."
  }
}
