{
  "protocol": "mythos-control/1",
  "task_id": "gh-issue-109",
  "status": "COMPLETED",
  "summary": "Investigation of WhatsApp Bridge merge conflict from PR #108 complete. The WhatsApp notification layer (commit b37491f, created from base ccedcbc) and current main (5ada6f0) diverged after gh-issue-103 (GitHub Issues intake) and gh-issue-100 (Model policy) were added. Conflicts are localized to github-bridge.js (requires/exports/tick logic), bin/mythos-github-bridge (tick/commands/usage), and documentation. The three features are architecturally orthogonal and can be integrated via careful manual merging. WhatsApp scope verified as GitHub Bridge notifications only; provider not deployed; 116 tests passed against local fake gateway.",
  "files_changed": [],
  "commits": [],
  "tests": [
    "mythos-bridge-whatsapp-notify-test.js: 116 passed (from b37491f commit message)",
    "mythos-github-bridge-test.js: 97 passed (from b37491f commit message)",
    "mythos-ai-executor-test.js: 265 passed (from b37491f commit message)",
    "mythos-governance-invariant-test.js: 111 passed (from b37491f commit message)"
  ],
  "validation": {
    "git_verified": null,
    "remote_head": null,
    "report_problems": [],
    "required_checks": []
  },
  "problems": [],
  "risks": [
    "WhatsApp provider (Evolution API) not deployed or live-verified",
    "Provider choice provisional and requires live verification",
    "No real WhatsApp smoke test performed",
    "Swap pressure at time of WhatsApp development (4095/4095 MiB) may constrain deployment task timing",
    "Merge resolution requires careful handling of module.exports and CLI interface changes"
  ],
  "next_recommended_action": "Create implementation task (not investigate): rebase WhatsApp changes from b37491f onto current origin/main (5ada6f0), resolve conflicts in github-bridge.js (requires/exports), bin/mythos-github-bridge (tick/commands), and documentation, run full test suite, create PR for review before merge",
  "completed_at": "2026-09-03T02:39:22.248Z",
  "execution": {
    "executor_task_id": "t-20260903023704-os01sv",
    "othmode_task_id": "OTH-2026-00040",
    "execution_profile": "repo-read",
    "provider": "claude-code",
    "model": "claude-haiku-4-5",
    "model_requested": null,
    "model_selection_mode": "auto",
    "model_selection_reason": "auto:fast→haiku score=0 [no signals]",
    "claude_session_id": "f6dbe60b-b498-4bff-8ab6-ac7af7caccf4",
    "executor_status": "COMPLETED",
    "started_at": "2026-09-03T02:37:07.128Z",
    "ended_at": "2026-09-03T02:38:58.354Z",
    "retries": 0,
    "quota_waits": 0,
    "cost_usd": 0.24689500000000003,
    "worktree": "/home/deploy/mythos-ai-executor/worktrees/gh/gh-issue-109",
    "branch": "mythos/gh/gh-issue-109",
    "base_commit": "5ada6f0f7bb241c0e7009e840a6e1ee2c6567e55",
    "othmode_closed_by_bridge": true
  },
  "delivery": {
    "branch": "mythos/gh/gh-issue-109",
    "commits_on_origin": null,
    "note": "Task-branch commits reach GitHub through the governance relay (mythos-git-push.timer, fast-forward only, every 5 min) and are NOT merged to main; merging is a human decision."
  }
}
