{
  "protocol": "mythos-control/1",
  "task_id": "gh-issue-106-r5",
  "status": "BLOCKED",
  "summary": "Preflight confirmed the worktree and the VPS shared checkout (/home/deploy/projects/mythos-prod) are both already at origin/main 5ada6f0 (includes merged PR #105 / Resource Guard), so no git update was needed. However, this session's sandbox restricts filesystem access to the assigned worktree only and refuses systemctl and curl commands with an approval requirement that has no interactive user to satisfy in this autonomous run. The objective's required actions (restart mythos-ai-executor.service, live Resource Guard status check, live Executor/Bridge health check) could therefore not be performed. Process evidence (pid 2612815, started ~01:32) suggests the running service likely already has Resource Guard loaded but is stale on a later fix (poll-interval change from 02:10), though this is unconfirmed without a live restart/check. No files were edited and no commits were made; findings were recorded as a non-terminal update to OTH-2026-00039.",
  "files_changed": [],
  "commits": [],
  "tests": [
    "git -C shared-checkout rev-parse/reflog: read-only, succeeded",
    "systemctl status: blocked (approval required, unavailable)",
    "curl localhost health: blocked (approval required, unavailable)",
    "ls shared-checkout scripts dir: blocked by sandbox"
  ],
  "validation": {
    "git_verified": false,
    "remote_head": null,
    "report_problems": [
      "delivery expected a commit but the report claims none"
    ],
    "required_checks": []
  },
  "problems": [
    "delivery expected a commit but the report claims none"
  ],
  "risks": [
    "mythos-ai-executor.service may be running code older than the latest main fix (poll-interval change) until an authorized restart is performed",
    "Resource Guard's live-loaded state on the running process is unverified"
  ],
  "next_recommended_action": "A session/operator with systemctl and network-health tool access must restart mythos-ai-executor.service and perform the live Resource Guard / Executor / Bridge health checks; this session cannot obtain that access autonomously.",
  "completed_at": "2026-09-03T02:23:02.288Z",
  "execution": {
    "executor_task_id": "t-20260903021824-ibkpu1",
    "othmode_task_id": "OTH-2026-00039",
    "execution_profile": "repo-write",
    "provider": "claude-code",
    "model": "claude-sonnet-5",
    "model_requested": null,
    "model_selection_mode": "auto",
    "model_selection_reason": "auto:balanced→sonnet score=5 [execution_profile:repo-write+2 task_category:implement+3]",
    "claude_session_id": "eb5a0c8a-7e23-4b2e-814c-3e86fd14848b",
    "executor_status": "BLOCKED",
    "started_at": "2026-09-03T02:18:36.697Z",
    "ended_at": "2026-09-03T02:22:05.856Z",
    "retries": 0,
    "quota_waits": 0,
    "cost_usd": 0.7916465999999999,
    "worktree": "/home/deploy/mythos-ai-executor/worktrees/gh/gh-issue-106-r5",
    "branch": "mythos/gh/gh-issue-106-r5",
    "base_commit": "5ada6f0f7bb241c0e7009e840a6e1ee2c6567e55",
    "othmode_closed_by_bridge": true
  },
  "delivery": {
    "branch": "mythos/gh/gh-issue-106-r5",
    "commits_on_origin": null,
    "note": "Task-branch commits reach GitHub through the governance relay (mythos-git-push.timer, fast-forward only, every 5 min) and are NOT merged to main; merging is a human decision."
  }
}
