{
  "protocol": "mythos-control/1",
  "task_id": "gh-issue-112",
  "status": "COMPLETED",
  "summary": "Root-caused gh-issue-111's routing failure to a real parser bug: bridge/github-issues.js silently ignored a bulleted \"- Action: implement\" line (bullet prefix defeated the alias lookup), indistinguishable from stating no Action at all, so an executive Issue fell back to requested_action=investigate/repo-read and the run later ended BLOCKED with no diagnosable reason because it never produced a mythos_report block. Fixed the bullet-prefix parsing gap, made lib/report.js's extractReport() name which of four distinct failure shapes occurred when no report is found (quoting the provider's actual final words), wired that diagnosis into executor.js's BLOCKED next_action, and strengthened templates/task-prompt.md to require the final report block even when a run stops for a permission/approval denial. Added regression tests for bulleted Action forms, a rerun's explicit Action overriding a wrongly-inherited default, and each report-extraction failure shape. All directly relevant suites pass.",
  "files_changed": [
    "projects/mythos-ai-executor/bridge/github-issues.js",
    "projects/mythos-ai-executor/executor.js",
    "projects/mythos-ai-executor/lib/report.js",
    "projects/mythos-ai-executor/templates/task-prompt.md",
    "tests/mythos-ai-executor-test.js",
    "tests/mythos-github-issues-test.js"
  ],
  "commits": [
    {
      "sha": "365a6a61eee1a590f960944bfa4f060c1953fd60",
      "subject": "fix(github-issues): honour a bulleted Action field; diagnose missing structured reports",
      "branch": "mythos/gh/gh-issue-112",
      "on_origin": true
    }
  ],
  "tests": [
    "node --check (all changed .js files): pass",
    "tests/mythos-github-issues-test.js: 143 passed, 0 failed",
    "tests/mythos-ai-executor-test.js: 270 passed, 0 failed",
    "tests/mythos-github-bridge-test.js: 97 passed, 0 failed",
    "tests/mythos-governance-invariant-test.js: 111 passed, 0 failed",
    "tests/model-selection-policy-test.js: 75 passed, 0 failed"
  ],
  "validation": {
    "git_verified": false,
    "remote_head": "5ada6f0f7bb241c0e7009e840a6e1ee2c6567e55",
    "report_problems": [],
    "required_checks": []
  },
  "problems": [],
  "risks": [
    "requested_action=investigate remains a permanent, explicit safe default (by design) when an Issue truly states no Action — an Issue whose objective reads as executive but never states Action:/action: label still needs the owner to add it explicitly; this task does not infer intent from prose, matching the required 'no auto-implement' regression",
    "This sandboxed session could not fetch the live GitHub Issue #111 body via `gh` (network calls require interactive approval unavailable here), so the bulleted-Action root cause was confirmed from the committed control/report files on origin rather than the raw Issue text directly — high confidence given attempt 1's own notes ('defaulted... because the Issue did not state one') plus the general parser gap reproduced and fixed here, but not a byte-for-byte replay of issue #111's exact original body",
    "Delivery to origin is the governance relay's job (this session never runs git push); the commit is verified locally on the worktree HEAD only"
  ],
  "next_recommended_action": "Owner/relay review and merge to main; then gh-issue-111 can be retried (rerun label + corrected body, or a fresh Issue) with Action: implement and should now route to repo-write with a diagnosable outcome either way",
  "completed_at": "2026-09-03T03:14:02.417Z",
  "execution": {
    "executor_task_id": "t-20260903030234-2x43ix",
    "othmode_task_id": "OTH-2026-00044",
    "execution_profile": "repo-write",
    "provider": "claude-code",
    "model": "claude-sonnet-5",
    "model_requested": null,
    "model_selection_mode": "auto",
    "model_selection_reason": "auto:balanced→sonnet score=5 [execution_profile:repo-write+2 task_category:implement+3]",
    "claude_session_id": "f724c703-4c60-450c-be10-8de3f456688f",
    "executor_status": "COMPLETED",
    "started_at": "2026-09-03T03:02:37.805Z",
    "ended_at": "2026-09-03T03:13:11.954Z",
    "retries": 0,
    "quota_waits": 0,
    "cost_usd": 3.6928436000000007,
    "worktree": "/home/deploy/mythos-ai-executor/worktrees/gh/gh-issue-112",
    "branch": "mythos/gh/gh-issue-112",
    "base_commit": "5ada6f0f7bb241c0e7009e840a6e1ee2c6567e55",
    "othmode_closed_by_bridge": true
  },
  "delivery": {
    "branch": "mythos/gh/gh-issue-112",
    "commits_on_origin": true,
    "note": "Task-branch commits reach GitHub through the governance relay (mythos-git-push.timer, fast-forward only, every 5 min) and are NOT merged to main; merging is a human decision.",
    "confirmed_on_origin_at": "2026-09-03T03:16:22.250Z"
  }
}
