{
  "protocol": "mythos-control/1",
  "task_id": "gh-issue-118-r2",
  "attempt_id": "gh-issue-118-r2#2",
  "status": "COMPLETED",
  "summary": "gh-issue-118-r2: on top of PR #119, added a durable retry policy (transient/permanent/governance/permission/human classification, exponential backoff with additive jitter, governance/permission never auto-retried, last_failure/retry_backoff/transition_reason recorded and copied into the control report), a runtime gate that refuses new claims on RUNTIME_IDENTITY_UNVERIFIED/MISMATCH by default with a recorded opt-out, once-only lease-expiry observation without re-execution, and a decided-only inheritance rule for reruns; tests, docs (§12e) and handover updated; committed 106d1c7 on mythos/gh/gh-issue-118-r2 over 41823e9; not pushed (governance relay); not merged.",
  "resolution": {
    "requested_action": "implement",
    "action_raw": "implement",
    "action_source": "explicit_current_issue",
    "execution_profile": "repo-write",
    "expected_profile": "repo-write",
    "model_requested": "Fable 5.1",
    "model_key": "fable-5.1",
    "model": "claude-fable-5-1",
    "model_source": "explicit_current_issue",
    "model_selection_mode": "explicit",
    "model_selection_reason": "explicit:fable-5.1 (requested \"fable-5.1\")",
    "base_sha": "41823e9ec7556fd7965b9fb544d2b0177e7e3ea5",
    "branch": "mythos/gh/gh-issue-118-r2",
    "commit_sha": "106d1c732483c0863b14dd478986ca3a40e08c55"
  },
  "blocker": null,
  "runtime_identity": {
    "module": "/home/deploy/projects/mythos-prod/projects/mythos-ai-executor/bridge/github-bridge.js",
    "checkout": "/home/deploy/projects/mythos-prod",
    "head": "41823e9ec7556fd7965b9fb544d2b0177e7e3ea5",
    "branch": "main",
    "dirty_files": 0,
    "base_ref": "origin/main",
    "base_ref_head": "41823e9ec7556fd7965b9fb544d2b0177e7e3ea5",
    "expected_head": null,
    "host": "vps-4722f0a9",
    "user": "deploy",
    "node": "v22.22.1",
    "verified": true,
    "stale": false,
    "code": null,
    "reason": null,
    "measured_at": "2026-09-03T10:59:34.268Z"
  },
  "structured_report": {
    "mythos_report": true,
    "status": "completed",
    "summary": "gh-issue-118-r2: on top of PR #119, added a durable retry policy (transient/permanent/governance/permission/human classification, exponential backoff with additive jitter, governance/permission never auto-retried, last_failure/retry_backoff/transition_reason recorded and copied into the control report), a runtime gate that refuses new claims on RUNTIME_IDENTITY_UNVERIFIED/MISMATCH by default with a recorded opt-out, once-only lease-expiry observation without re-execution, and a decided-only inheritance rule for reruns; tests, docs (§12e) and handover updated; committed 106d1c7 on mythos/gh/gh-issue-118-r2 over 41823e9; not pushed (governance relay); not merged.",
    "tests": [
      "tests/bridge-action-resolution-test.js: 88 passed, 0 failed",
      "tests/mythos-ai-executor-test.js: 390 passed, 0 failed",
      "tests/mythos-github-bridge-test.js: 150 passed, 0 failed",
      "tests/mythos-github-issues-test.js: 193 passed, 0 failed",
      "tests/model-selection-policy-test.js: 81 passed, 0 failed",
      "tests/mythos-governance-invariant-test.js: 111 passed, 0 failed",
      "tests/mythos-unattended-policy-test.js: 53 passed, 0 failed",
      "node --check on all changed JS: ok",
      "git diff --check: clean"
    ],
    "commit": "106d1c732483c0863b14dd478986ca3a40e08c55",
    "remote_head": "41823e9ec7556fd7965b9fb544d2b0177e7e3ea5",
    "files_changed": [
      "docs/AI_HANDOVER.md",
      "docs/MYTHOS_GITHUB_BRIDGE.md",
      "docs/MYTHOS_GITHUB_ISSUES.md",
      "projects/mythos-ai-executor/bin/mythos-github-bridge",
      "projects/mythos-ai-executor/bridge/action-resolution.js",
      "projects/mythos-ai-executor/bridge/github-bridge.js",
      "projects/mythos-ai-executor/bridge/github-issues.js",
      "projects/mythos-ai-executor/executor.js",
      "projects/mythos-ai-executor/lib/quota.js",
      "projects/mythos-ai-executor/lib/state.js",
      "tests/bridge-action-resolution-test.js",
      "tests/mythos-ai-executor-test.js",
      "tests/mythos-github-bridge-test.js",
      "tests/mythos-github-issues-test.js"
    ],
    "residual_risks": [
      "remote_head is origin/mythos/gh/gh-issue-118-r2 at report time (still the base 41823e9); the governance relay has not yet delivered 106d1c7",
      "runtime gate default is stricter: a bridge whose module is not inside a git checkout defers every claim until MYTHOS_BRIDGE_ALLOW_UNVERIFIED_RUNTIME=1 is set deliberately — verify `mythos-github-bridge runtime` after deploy",
      "failure classification is regex-based on provider text; unforeseen wording lands in `permanent` (FAILED, no retry) — visible, never silent",
      "lease expiry is observed, not enforced; a hung executor run still relies on the executor's own timeout",
      "behaviour change: a rerun of a previously defaulted attempt is now action_source=default, not inherited",
      "running services keep old behaviour until merge + restart (owner action)"
    ],
    "next_stage": "owner review/merge of mythos/gh/gh-issue-118-r2, then restart mythos-ai-executor.service and mythos-github-bridge and check `mythos-github-bridge runtime` gate on the host"
  },
  "files_changed": [
    "docs/AI_HANDOVER.md",
    "docs/MYTHOS_GITHUB_BRIDGE.md",
    "docs/MYTHOS_GITHUB_ISSUES.md",
    "projects/mythos-ai-executor/bin/mythos-github-bridge",
    "projects/mythos-ai-executor/bridge/action-resolution.js",
    "projects/mythos-ai-executor/bridge/github-bridge.js",
    "projects/mythos-ai-executor/bridge/github-issues.js",
    "projects/mythos-ai-executor/executor.js",
    "projects/mythos-ai-executor/lib/quota.js",
    "projects/mythos-ai-executor/lib/state.js",
    "tests/bridge-action-resolution-test.js",
    "tests/mythos-ai-executor-test.js",
    "tests/mythos-github-bridge-test.js",
    "tests/mythos-github-issues-test.js"
  ],
  "commits": [
    {
      "sha": "106d1c732483c0863b14dd478986ca3a40e08c55",
      "subject": "fix(bridge): retry policy, runtime gate, lease expiry, decided-only inheritance (gh-issue-118-r2)",
      "branch": "mythos/gh/gh-issue-118-r2",
      "on_origin": true
    }
  ],
  "tests": [
    "tests/bridge-action-resolution-test.js: 88 passed, 0 failed",
    "tests/mythos-ai-executor-test.js: 390 passed, 0 failed",
    "tests/mythos-github-bridge-test.js: 150 passed, 0 failed",
    "tests/mythos-github-issues-test.js: 193 passed, 0 failed",
    "tests/model-selection-policy-test.js: 81 passed, 0 failed",
    "tests/mythos-governance-invariant-test.js: 111 passed, 0 failed",
    "tests/mythos-unattended-policy-test.js: 53 passed, 0 failed",
    "node --check on all changed JS: ok",
    "git diff --check: clean"
  ],
  "validation": {
    "git_verified": false,
    "remote_head": "41823e9ec7556fd7965b9fb544d2b0177e7e3ea5",
    "report_problems": [],
    "required_checks": []
  },
  "problems": [],
  "risks": [
    "remote_head is origin/mythos/gh/gh-issue-118-r2 at report time (still the base 41823e9); the governance relay has not yet delivered 106d1c7",
    "runtime gate default is stricter: a bridge whose module is not inside a git checkout defers every claim until MYTHOS_BRIDGE_ALLOW_UNVERIFIED_RUNTIME=1 is set deliberately — verify `mythos-github-bridge runtime` after deploy",
    "failure classification is regex-based on provider text; unforeseen wording lands in `permanent` (FAILED, no retry) — visible, never silent",
    "lease expiry is observed, not enforced; a hung executor run still relies on the executor's own timeout",
    "behaviour change: a rerun of a previously defaulted attempt is now action_source=default, not inherited",
    "running services keep old behaviour until merge + restart (owner action)"
  ],
  "next_recommended_action": "owner review/merge of mythos/gh/gh-issue-118-r2, then restart mythos-ai-executor.service and mythos-github-bridge and check `mythos-github-bridge runtime` gate on the host",
  "completed_at": "2026-09-03T11:22:12.541Z",
  "execution": {
    "executor_task_id": "t-20260903105935-j13m7h",
    "othmode_task_id": "OTH-2026-00052",
    "execution_profile": "repo-write",
    "provider": "claude-code",
    "model": "claude-fable-5-1",
    "model_requested": "Fable 5.1",
    "model_source": "explicit_current_issue",
    "action_source": "explicit_current_issue",
    "action_raw": "implement",
    "attempt_id": "gh-issue-118-r2#2",
    "fence": 29,
    "lease": {
      "owner": "github-bridge@vps-4722f0a9:3982394",
      "fence": 29,
      "acquired_at": "2026-09-03T10:59:35.951Z",
      "expires_at": "2026-09-03T12:29:35.951Z"
    },
    "snapshot_sha256": "3b4b7f7b7312376219242b194d13cbc1f4546abab6aece37de7611b118cb85e5",
    "model_selection_mode": "explicit",
    "model_selection_reason": "explicit:fable-5.1 (requested \"fable-5.1\")",
    "claude_session_id": "0754437c-db9d-4153-afa3-bbaba8c63b70",
    "executor_status": "COMPLETED",
    "started_at": "2026-09-03T10:59:38.179Z",
    "ended_at": "2026-09-03T11:21:33.695Z",
    "retries": 0,
    "quota_waits": 0,
    "cost_usd": 13.198542999999999,
    "worktree": "/home/deploy/mythos-ai-executor/worktrees/gh/gh-issue-118-r2",
    "branch": "mythos/gh/gh-issue-118-r2",
    "base_commit": "41823e9ec7556fd7965b9fb544d2b0177e7e3ea5",
    "othmode_closed_by_bridge": true
  },
  "delivery": {
    "branch": "mythos/gh/gh-issue-118-r2",
    "commits_on_origin": true,
    "note": "Task-branch commits reach GitHub through the governance relay (mythos-git-push.timer, fast-forward only, every 5 min) and are NOT merged to main; merging is a human decision.",
    "confirmed_on_origin_at": "2026-09-03T11:28:02.551Z"
  }
}
